[
  {
    "id": "pankow-musikschule-bela-bartok",
    "name": "Musikschule Béla Bartók Berlin-Pankow",
    "category": "MUN",
    "district": "Pankow",
    "address": {
      "street": "Am Schloßpark 20",
      "postcode": "13187",
      "city": "Berlin"
    },
    "sites": [
      {
        "name": "Prenzlauer Berg",
        "street": "Senefelderstraße 6",
        "postcode": "10435"
      },
      {
        "name": "Weißensee",
        "street": "Bizetstraße 27",
        "postcode": "13088"
      },
      {
        "name": "Karow/Buch",
        "street": "Friedrich-Richter-Straße 8",
        "postcode": "13125"
      }
    ],
    "contact": {
      "phone": "(030) 90295-6730",
      "website": "https://www.berlin.de/musikschule-pankow/",
      "email": "musikschule@ba-pankow.berlin.de",
      "email_source_url": "https://www.berlin.de/musikschule-pankow/"
    },
    "offer": {
      "status": "none_found",
      "checked": "2026-10-15"
    },
    "contract": {
      "type": "mixed",
      "is_guess": true
    },
    "conditions": {
      "pay": "34,85 (Honorarsatz 1, with full qualification) / 38,18 (Honorarsatz 2, ensembles)",
      "pay_unit": "EUR/45 min",
      "pay_source_url": "https://www.berlin.de/sen/kultur/kultureinrichtungen/musikschulen/av-mus-honorare-gesamt_neu.pdf",
      "requirements": "AV MuS-Honorare expires on 31.12.2026; 2027 conditions yet to be published. Permanent posts (TV Musikschullehrkräfte, EG 9b) are advertised on the Karriereportal."
    },
    "email_language": "de",
    "summary_en": "Pankow's municipal music school with a strings department (violin, viola, cello, bass) across four sites and several string ensembles. No open posting on 2026-10-15; the last Pankow violin post (Karriereportal) is closed.",
    "sources": [
      "https://www.berlin.de/musikschule-pankow/",
      "https://www.berlin.de/musikschule-pankow/fachgruppen/streichinstrumente/",
      "https://www.berlin.de/musikschule-pankow/fachgruppen/ensembles/",
      "https://www.berlin.de/sen/kultur/kultureinrichtungen/musikschulen/av-mus-honorare-gesamt_neu.pdf"
    ],
    "last_verified": "2026-10-15",
    "instruments": [
      "strings",
      "keyboard",
      "woodwind",
      "brass",
      "guitar_plucked",
      "accordion",
      "voice",
      "percussion"
    ],
    "instruments_detail": [
      "violin",
      "viola",
      "cello",
      "double bass",
      "piano",
      "accordion",
      "plucked strings",
      "wind instruments",
      "rock/pop/jazz instruments",
      "singing",
      "ensembles"
    ],
    "found_by": "district-scout:pankow"
  },
  {
    "id": "pankow-wundermusikschule",
    "name": "WunderMusikSchule",
    "category": "PRV",
    "district": "Pankow",
    "address": {
      "street": "Mühlenstraße 42",
      "postcode": "13187",
      "city": "Berlin"
    },
    "sites": [
      {
        "name": "Standort Görschstraße",
        "street": "Görschstraße 50",
        "postcode": "13187"
      }
    ],
    "contact": {
      "email": "info@wundermusikschule.de",
      "email_source_url": "https://wundermusikschule.de/mehr/stellenangebote/",
      "phone": "030-49951366",
      "website": "https://wundermusikschule.de/",
      "application_portal": "https://wundermusikschule.de/mehr/stellenangebote/"
    },
    "offer": {
      "status": "initiative_welcome",
      "title": "Lehrkräfte gesucht (EMP, Klavier, Gitarre und andere Fächer/Instrumente)",
      "url": "https://wundermusikschule.de/mehr/stellenangebote/",
      "checked": "2026-10-15"
    },
    "contract": {
      "type": "honorar_hourly",
      "evidence": "Lehrkräfte, die selbstständig auf Honorarbasis arbeiten",
      "is_guess": false
    },
    "conditions": {
      "pay": "No figure published ('überdurchschnittlich hohe Honorare')",
      "requirements": "Gute Deutschkenntnisse; musikpädagogische Ausbildung oder Studium in mindestens einem Fach (or in progress)."
    },
    "email_language": "de",
    "summary_en": "Private music school in Pankow offering violin and viola, with about 40 freelance teachers on a fee basis. Its job page invites applications but lists no dated vacancy.",
    "sources": [
      "https://wundermusikschule.de/mehr/stellenangebote/",
      "https://wundermusikschule.de/impressum/",
      "https://wundermusikschule.de/"
    ],
    "last_verified": "2026-10-15",
    "instruments": [
      "strings",
      "keyboard",
      "woodwind",
      "guitar_plucked",
      "accordion",
      "voice",
      "percussion"
    ],
    "instruments_detail": [
      "violin",
      "viola",
      "cello",
      "double bass",
      "piano",
      "keyboard",
      "accordion",
      "guitar",
      "ukulele",
      "mandolin",
      "harp",
      "recorder",
      "flute",
      "clarinet",
      "saxophone",
      "drums",
      "singing"
    ],
    "found_by": "district-scout:pankow"
  },
  {
    "id": "pankow-musikschule-tomatenklang",
    "name": "Musikschule tomatenklang",
    "category": "PRV",
    "secondary_categories": [
      "EDU"
    ],
    "address": {
      "street": "Immanuelkirchstraße 23",
      "postcode": "10405",
      "city": "Berlin"
    },
    "sites": [
      {
        "name": "Standort Marienburger Straße (Kollwitzkiez)",
        "street": "Marienburger Straße 31",
        "postcode": "10405"
      },
      {
        "name": "Standort Marienburger Straße 29",
        "street": "Marienburger Straße 29",
        "postcode": "10405"
      },
      {
        "name": "Standort Christburger Straße",
        "street": "Christburger Straße 45",
        "postcode": "10405"
      },
      {
        "name": "Standort Käthe-Niederkirchner-Straße",
        "street": "Käthe-Niederkirchner-Str. 9",
        "postcode": "10407"
      },
      {
        "name": "Standort Prenzlauer Allee",
        "street": "Prenzlauer Allee 210",
        "postcode": "10405"
      },
      {
        "name": "Standort Schönfließer Straße",
        "street": "Schönfließer Straße 18",
        "postcode": "10439"
      },
      {
        "name": "Standort Wisbyer Straße",
        "street": "Wisbyer Straße 4",
        "postcode": "10439"
      },
      {
        "name": "Standort Rosenthal (Landhaus Rosenthal)",
        "street": "Hauptstraße 94",
        "postcode": "13158"
      },
      {
        "name": "Zentrale Kreuzberg (Wrangelkiez)",
        "street": "Falckensteinstraße 29",
        "postcode": "10997"
      }
    ],
    "contact": {
      "email": "info@tomatenklang.de",
      "email_source_url": "https://www.tomatenklang.de/impressum/",
      "phone": "(030) 44 04 20 05",
      "website": "https://www.tomatenklang.de/"
    },
    "offer": {
      "status": "none_found",
      "checked": "2026-10-15"
    },
    "contract": {
      "type": "unknown"
    },
    "email_language": "de",
    "summary_en": "Non-profit private music school with several sites in Prenzlauer Berg, a large violin faculty, one viola teacher, ensembles and school/Kita programmes. No job page found.",
    "sources": [
      "https://www.tomatenklang.de/",
      "https://www.tomatenklang.de/impressum/",
      "https://www.tomatenklang.de/musikschule-uebersicht-lehrer/",
      "https://www.tomatenklang.de/en/viola-lessons-prenzlauer-berg/"
    ],
    "last_verified": "2026-10-15",
    "district": "Pankow",
    "instruments": [
      "strings",
      "keyboard",
      "woodwind",
      "brass",
      "guitar_plucked",
      "accordion",
      "voice",
      "percussion"
    ],
    "instruments_detail": [
      "violin",
      "viola",
      "cello",
      "double bass",
      "piano",
      "harpsichord",
      "accordion",
      "harp",
      "guitar",
      "lute",
      "mandolin",
      "ukulele",
      "recorder",
      "flute",
      "oboe",
      "clarinet",
      "saxophone",
      "trumpet",
      "trombone",
      "horn",
      "euphonium",
      "drums",
      "percussion",
      "singing"
    ],
    "found_by": "district-scout:pankow"
  },
  {
    "id": "pankow-musikschule-juettner",
    "name": "Musikschule Jüttner & Co.",
    "category": "PRV",
    "address": {
      "street": "Kuglerstraße 81",
      "postcode": "10439",
      "city": "Berlin"
    },
    "sites": [
      {
        "name": "Prenzlauer Berg Gethsemane",
        "street": "Gethsemanestraße 3",
        "postcode": "10437"
      },
      {
        "name": "Pankow",
        "street": "Florastraße 60/62",
        "postcode": "13187"
      }
    ],
    "contact": {
      "email": "kontakt@musikschule-juettner.de",
      "email_source_url": "https://www.musikschule-juettner.de/impressum",
      "website": "https://www.musikschule-juettner.de/",
      "application_portal": "https://www.musikschule-juettner.de/jobs/"
    },
    "offer": {
      "status": "initiative_welcome",
      "title": "Lehrer:innen für verschiedene Fächer gesucht",
      "url": "https://www.musikschule-juettner.de/jobs/",
      "checked": "2026-10-15"
    },
    "contract": {
      "type": "employment",
      "evidence": "Festanstellung",
      "is_guess": false
    },
    "conditions": {
      "requirements": "Musik- oder Pädagogikstudium oder Unterrichtserfahrung; flexible Unterrichtstage."
    },
    "email_language": "de",
    "summary_en": "Private music school with sites in Pankow and Prenzlauer Berg teaching violin, viola and cello. Its jobs page seeks teachers for various subjects with permanent employment.",
    "sources": [
      "https://www.musikschule-juettner.de/",
      "https://www.musikschule-juettner.de/jobs/",
      "https://www.musikschule-juettner.de/impressum"
    ],
    "last_verified": "2026-10-15",
    "district": "Pankow",
    "instruments": [
      "strings",
      "keyboard",
      "woodwind",
      "guitar_plucked",
      "voice"
    ],
    "instruments_detail": [
      "violin",
      "viola",
      "cello",
      "piano",
      "classical guitar",
      "electric guitar",
      "electric bass",
      "recorder",
      "oboe",
      "clarinet",
      "saxophone",